{
  "classification": "synthetic_stress",
  "constraints": {
    "budget": 12,
    "budgetUnit": "normalized_cost",
    "maxInterventions": 1,
    "maxLeadTimeDays": 21
  },
  "decisionCutoff": "2026-08-12T00:00:00Z",
  "graphSnapshotId": "snapshot:ofac-list-change-stress:assumed-topology",
  "interventions": [
    {
      "cost": 8,
      "costUnit": "normalized_cost",
      "effect": 0.35,
      "evidenceGrade": "MODEL_INFERRED",
      "id": "intervention:ofac-list-change-stress:buffer",
      "label": "Add screening review capacity",
      "leadTimeDays": 14,
      "rationale": "Illustrative intervention parameter; feasibility does not imply operational suitability.",
      "targetEdgeIds": [],
      "targetNodeIds": [
        "node:ofac-list-change-stress:screening"
      ],
      "type": "buffer"
    },
    {
      "cost": 13,
      "costUnit": "normalized_cost",
      "effect": 0.5,
      "evidenceGrade": "MODEL_INFERRED",
      "id": "intervention:ofac-list-change-stress:diversify",
      "label": "Diversify eligible suppliers",
      "leadTimeDays": 45,
      "rationale": "Illustrative intervention parameter; feasibility does not imply operational suitability.",
      "targetEdgeIds": [
        "edge:ofac-list-change-stress:link-2"
      ],
      "targetNodeIds": [],
      "type": "diversify"
    },
    {
      "cost": 11,
      "costUnit": "normalized_cost",
      "effect": 0.4,
      "evidenceGrade": "MODEL_INFERRED",
      "id": "intervention:ofac-list-change-stress:reroute",
      "label": "Route transactions for manual review",
      "leadTimeDays": 7,
      "rationale": "Illustrative intervention parameter; feasibility does not imply operational suitability.",
      "targetEdgeIds": [
        "edge:ofac-list-change-stress:link-1"
      ],
      "targetNodeIds": [],
      "type": "reroute"
    }
  ],
  "limitations": [
    "Scenario-only reference case; it has not been compared with separated real-world outcomes.",
    "All graph links, weights, shock magnitudes, costs, and intervention effects are explicit model assumptions.",
    "Outputs are not forecasts, causal estimates, realized losses, or evidence of external use.",
    "This is not sanctions screening, legal advice, or a determination that any party is restricted."
  ],
  "objectives": [
    {
      "id": "objective:ofac-list-change-stress:risk",
      "metric": "residual_impact",
      "sense": "minimize"
    },
    {
      "id": "objective:ofac-list-change-stress:cost",
      "metric": "cost",
      "sense": "minimize"
    }
  ],
  "propagation": {
    "bounds": [
      "lower",
      "central",
      "upper"
    ],
    "engine": "dependency_cascade",
    "horizonsDays": [
      3,
      14,
      60
    ],
    "maxIterations": 100,
    "tolerance": 1e-9,
    "transmission": 0.82
  },
  "scenarioId": "ofac-list-change-stress",
  "schemaVersion": "0.1.0",
  "shocks": [
    {
      "endsAt": "2026-09-30T00:00:00Z",
      "id": "shock:ofac-list-change-stress:primary",
      "label": "Counterparty eligibility restriction",
      "magnitude": 0.5,
      "operation": "policy_restrict",
      "rationale": "Forward-dated stress inspired by the context reference; timing and magnitude are explicit scenario parameters.",
      "sourceIds": [
        "source:ofac-list-change-stress:context"
      ],
      "startsAt": "2026-09-01T00:00:00Z",
      "target": {
        "ids": [
          "node:ofac-list-change-stress:list-change"
        ]
      },
      "unit": "share"
    }
  ],
  "summary": "A synthetic operational stress exploring how a sanctions-list change could affect assumed screening, payment, supplier, and delivery dependencies.",
  "title": "Sanctions-list change stress"
}
