{
  "classification": "quasi_historical",
  "constraints": {
    "budget": 22,
    "budgetUnit": "normalized_cost",
    "maxInterventions": 2,
    "maxLeadTimeDays": 60
  },
  "decisionCutoff": "2026-08-12T00:00:00Z",
  "graphSnapshotId": "snapshot:medical-ppe-demand-restress:assumed-topology",
  "interventions": [
    {
      "cost": 8,
      "costUnit": "normalized_cost",
      "effect": 0.35,
      "evidenceGrade": "MODEL_INFERRED",
      "id": "intervention:medical-ppe-demand-restress:buffer",
      "label": "Build PPE buffer",
      "leadTimeDays": 14,
      "rationale": "Illustrative intervention parameter; feasibility does not imply operational suitability.",
      "targetEdgeIds": [],
      "targetNodeIds": [
        "node:medical-ppe-demand-restress:ppe"
      ],
      "type": "buffer"
    },
    {
      "cost": 13,
      "costUnit": "normalized_cost",
      "effect": 0.5,
      "evidenceGrade": "MODEL_INFERRED",
      "id": "intervention:medical-ppe-demand-restress:diversify",
      "label": "Diversify PPE suppliers",
      "leadTimeDays": 45,
      "rationale": "Illustrative intervention parameter; feasibility does not imply operational suitability.",
      "targetEdgeIds": [
        "edge:medical-ppe-demand-restress:link-2"
      ],
      "targetNodeIds": [],
      "type": "diversify"
    },
    {
      "cost": 11,
      "costUnit": "normalized_cost",
      "effect": 0.4,
      "evidenceGrade": "MODEL_INFERRED",
      "id": "intervention:medical-ppe-demand-restress:reroute",
      "label": "Prioritize scarce PPE allocation",
      "leadTimeDays": 7,
      "rationale": "Illustrative intervention parameter; feasibility does not imply operational suitability.",
      "targetEdgeIds": [
        "edge:medical-ppe-demand-restress:link-1"
      ],
      "targetNodeIds": [],
      "type": "reroute"
    }
  ],
  "limitations": [
    "Scenario-only reference case; it has not been compared with separated real-world outcomes.",
    "All graph links, weights, shock magnitudes, costs, and intervention effects are explicit model assumptions.",
    "Outputs are not forecasts, causal estimates, realized losses, or evidence of external use.",
    "The case is not a clinical model, shortage forecast, or emergency-response recommendation."
  ],
  "objectives": [
    {
      "id": "objective:medical-ppe-demand-restress:risk",
      "metric": "residual_impact",
      "sense": "minimize"
    },
    {
      "id": "objective:medical-ppe-demand-restress:cost",
      "metric": "cost",
      "sense": "minimize"
    }
  ],
  "propagation": {
    "bounds": [
      "lower",
      "central",
      "upper"
    ],
    "engine": "dependency_cascade",
    "horizonsDays": [
      7,
      21,
      60
    ],
    "maxIterations": 100,
    "tolerance": 1e-9,
    "transmission": 0.82
  },
  "scenarioId": "medical-ppe-demand-restress",
  "schemaVersion": "0.1.0",
  "shocks": [
    {
      "endsAt": "2026-09-30T00:00:00Z",
      "id": "shock:medical-ppe-demand-restress:primary",
      "label": "PPE demand surge",
      "magnitude": 1.2,
      "operation": "increase_demand",
      "rationale": "Forward-dated stress inspired by the context reference; timing and magnitude are explicit scenario parameters.",
      "sourceIds": [
        "source:medical-ppe-demand-restress:context"
      ],
      "startsAt": "2026-09-01T00:00:00Z",
      "target": {
        "ids": [
          "node:medical-ppe-demand-restress:ppe-demand"
        ]
      },
      "unit": "share"
    }
  ],
  "summary": "A forward-dated demand surge across an assumed personal-protective-equipment supply and care-delivery topology.",
  "title": "Medical PPE demand re-stress"
}
