{
  "classification": "quasi_historical",
  "constraints": {
    "budget": 22,
    "budgetUnit": "normalized_cost",
    "maxInterventions": 2,
    "maxLeadTimeDays": 60
  },
  "decisionCutoff": "2026-08-12T00:00:00Z",
  "graphSnapshotId": "snapshot:semiconductor-capacity-restress:assumed-topology",
  "interventions": [
    {
      "cost": 8,
      "costUnit": "normalized_cost",
      "effect": 0.35,
      "evidenceGrade": "MODEL_INFERRED",
      "id": "intervention:semiconductor-capacity-restress:buffer",
      "label": "Increase chip inventory",
      "leadTimeDays": 14,
      "rationale": "Illustrative intervention parameter; feasibility does not imply operational suitability.",
      "targetEdgeIds": [],
      "targetNodeIds": [
        "node:semiconductor-capacity-restress:chips"
      ],
      "type": "buffer"
    },
    {
      "cost": 13,
      "costUnit": "normalized_cost",
      "effect": 0.5,
      "evidenceGrade": "MODEL_INFERRED",
      "id": "intervention:semiconductor-capacity-restress:diversify",
      "label": "Qualify alternate chip designs",
      "leadTimeDays": 45,
      "rationale": "Illustrative intervention parameter; feasibility does not imply operational suitability.",
      "targetEdgeIds": [
        "edge:semiconductor-capacity-restress:link-2"
      ],
      "targetNodeIds": [],
      "type": "diversify"
    },
    {
      "cost": 11,
      "costUnit": "normalized_cost",
      "effect": 0.4,
      "evidenceGrade": "MODEL_INFERRED",
      "id": "intervention:semiconductor-capacity-restress:reroute",
      "label": "Reallocate available fabrication",
      "leadTimeDays": 7,
      "rationale": "Illustrative intervention parameter; feasibility does not imply operational suitability.",
      "targetEdgeIds": [
        "edge:semiconductor-capacity-restress:link-1"
      ],
      "targetNodeIds": [],
      "type": "reroute"
    }
  ],
  "limitations": [
    "Scenario-only reference case; it has not been compared with separated real-world outcomes.",
    "All graph links, weights, shock magnitudes, costs, and intervention effects are explicit model assumptions.",
    "Outputs are not forecasts, causal estimates, realized losses, or evidence of external use.",
    "The case does not estimate any company, facility, or sector's actual production loss."
  ],
  "objectives": [
    {
      "id": "objective:semiconductor-capacity-restress:risk",
      "metric": "residual_impact",
      "sense": "minimize"
    },
    {
      "id": "objective:semiconductor-capacity-restress:cost",
      "metric": "cost",
      "sense": "minimize"
    }
  ],
  "propagation": {
    "bounds": [
      "lower",
      "central",
      "upper"
    ],
    "engine": "dependency_cascade",
    "horizonsDays": [
      7,
      30,
      90
    ],
    "maxIterations": 100,
    "tolerance": 1e-9,
    "transmission": 0.82
  },
  "scenarioId": "semiconductor-capacity-restress",
  "schemaVersion": "0.1.0",
  "shocks": [
    {
      "endsAt": "2026-09-30T00:00:00Z",
      "id": "shock:semiconductor-capacity-restress:primary",
      "label": "Fabrication capacity reduction",
      "magnitude": 0.45,
      "operation": "multiply_capacity",
      "rationale": "Forward-dated stress inspired by the context reference; timing and magnitude are explicit scenario parameters.",
      "sourceIds": [
        "source:semiconductor-capacity-restress:context"
      ],
      "startsAt": "2026-09-01T00:00:00Z",
      "target": {
        "ids": [
          "node:semiconductor-capacity-restress:fabs"
        ]
      },
      "unit": "share"
    }
  ],
  "summary": "A forward-dated semiconductor capacity stress across assumed fabrication, component, assembly, and production dependencies.",
  "title": "Semiconductor capacity re-stress"
}
