{
  "classification": "synthetic_stress",
  "constraints": {
    "budget": 22,
    "budgetUnit": "normalized_cost",
    "maxInterventions": 2,
    "maxLeadTimeDays": 60
  },
  "decisionCutoff": "2026-08-12T00:00:00Z",
  "graphSnapshotId": "snapshot:critical-minerals-export-stress:assumed-topology",
  "interventions": [
    {
      "cost": 8,
      "costUnit": "normalized_cost",
      "effect": 0.35,
      "evidenceGrade": "MODEL_INFERRED",
      "id": "intervention:critical-minerals-export-stress:buffer",
      "label": "Increase mineral buffer",
      "leadTimeDays": 14,
      "rationale": "Illustrative intervention parameter; feasibility does not imply operational suitability.",
      "targetEdgeIds": [],
      "targetNodeIds": [
        "node:critical-minerals-export-stress:mineral"
      ],
      "type": "buffer"
    },
    {
      "cost": 13,
      "costUnit": "normalized_cost",
      "effect": 0.5,
      "evidenceGrade": "MODEL_INFERRED",
      "id": "intervention:critical-minerals-export-stress:diversify",
      "label": "Qualify alternate mineral supply",
      "leadTimeDays": 45,
      "rationale": "Illustrative intervention parameter; feasibility does not imply operational suitability.",
      "targetEdgeIds": [
        "edge:critical-minerals-export-stress:link-2"
      ],
      "targetNodeIds": [],
      "type": "diversify"
    },
    {
      "cost": 11,
      "costUnit": "normalized_cost",
      "effect": 0.4,
      "evidenceGrade": "MODEL_INFERRED",
      "id": "intervention:critical-minerals-export-stress:reroute",
      "label": "Reallocate material to critical uses",
      "leadTimeDays": 7,
      "rationale": "Illustrative intervention parameter; feasibility does not imply operational suitability.",
      "targetEdgeIds": [
        "edge:critical-minerals-export-stress:link-1"
      ],
      "targetNodeIds": [],
      "type": "reroute"
    }
  ],
  "limitations": [
    "Scenario-only reference case; it has not been compared with separated real-world outcomes.",
    "All graph links, weights, shock magnitudes, costs, and intervention effects are explicit model assumptions.",
    "Outputs are not forecasts, causal estimates, realized losses, or evidence of external use.",
    "The synthetic topology does not represent a named mineral, country, firm, or actual export-control measure."
  ],
  "objectives": [
    {
      "id": "objective:critical-minerals-export-stress:risk",
      "metric": "residual_impact",
      "sense": "minimize"
    },
    {
      "id": "objective:critical-minerals-export-stress:cost",
      "metric": "cost",
      "sense": "minimize"
    }
  ],
  "propagation": {
    "bounds": [
      "lower",
      "central",
      "upper"
    ],
    "engine": "dependency_cascade",
    "horizonsDays": [
      7,
      30,
      90
    ],
    "maxIterations": 100,
    "tolerance": 1e-9,
    "transmission": 0.82
  },
  "scenarioId": "critical-minerals-export-stress",
  "schemaVersion": "0.1.0",
  "shocks": [
    {
      "endsAt": "2026-09-30T00:00:00Z",
      "id": "shock:critical-minerals-export-stress:primary",
      "label": "Critical-mineral export restriction",
      "magnitude": 0.7,
      "operation": "policy_restrict",
      "rationale": "Forward-dated stress inspired by the context reference; timing and magnitude are explicit scenario parameters.",
      "sourceIds": [
        "source:critical-minerals-export-stress:context"
      ],
      "startsAt": "2026-09-01T00:00:00Z",
      "target": {
        "ids": [
          "node:critical-minerals-export-stress:exports"
        ]
      },
      "unit": "share"
    }
  ],
  "summary": "A synthetic export-control stress across an assumed mineral, component, manufacturing, and infrastructure chain.",
  "title": "Critical-minerals export-control stress"
}
