{
  "classification": "quasi_historical",
  "constraints": {
    "budget": 22,
    "budgetUnit": "normalized_cost",
    "maxInterventions": 2,
    "maxLeadTimeDays": 60
  },
  "decisionCutoff": "2026-08-12T00:00:00Z",
  "graphSnapshotId": "snapshot:ukraine-commodity-compound-restress:assumed-topology",
  "interventions": [
    {
      "cost": 8,
      "costUnit": "normalized_cost",
      "effect": 0.35,
      "evidenceGrade": "MODEL_INFERRED",
      "id": "intervention:ukraine-commodity-compound-restress:buffer",
      "label": "Increase essential-input reserves",
      "leadTimeDays": 14,
      "rationale": "Illustrative intervention parameter; feasibility does not imply operational suitability.",
      "targetEdgeIds": [],
      "targetNodeIds": [
        "node:ukraine-commodity-compound-restress:farm-inputs"
      ],
      "type": "buffer"
    },
    {
      "cost": 13,
      "costUnit": "normalized_cost",
      "effect": 0.5,
      "evidenceGrade": "MODEL_INFERRED",
      "id": "intervention:ukraine-commodity-compound-restress:diversify",
      "label": "Substitute farm inputs",
      "leadTimeDays": 45,
      "rationale": "Illustrative intervention parameter; feasibility does not imply operational suitability.",
      "targetEdgeIds": [
        "edge:ukraine-commodity-compound-restress:link-2"
      ],
      "targetNodeIds": [],
      "type": "diversify"
    },
    {
      "cost": 11,
      "costUnit": "normalized_cost",
      "effect": 0.4,
      "evidenceGrade": "MODEL_INFERRED",
      "id": "intervention:ukraine-commodity-compound-restress:reroute",
      "label": "Re-route food distribution",
      "leadTimeDays": 7,
      "rationale": "Illustrative intervention parameter; feasibility does not imply operational suitability.",
      "targetEdgeIds": [
        "edge:ukraine-commodity-compound-restress:link-1"
      ],
      "targetNodeIds": [],
      "type": "reroute"
    }
  ],
  "limitations": [
    "Scenario-only reference case; it has not been compared with separated real-world outcomes.",
    "All graph links, weights, shock magnitudes, costs, and intervention effects are explicit model assumptions.",
    "Outputs are not forecasts, causal estimates, realized losses, or evidence of external use.",
    "No country-level price, hunger, or welfare effect is estimated."
  ],
  "objectives": [
    {
      "id": "objective:ukraine-commodity-compound-restress:risk",
      "metric": "residual_impact",
      "sense": "minimize"
    },
    {
      "id": "objective:ukraine-commodity-compound-restress:cost",
      "metric": "cost",
      "sense": "minimize"
    }
  ],
  "propagation": {
    "bounds": [
      "lower",
      "central",
      "upper"
    ],
    "engine": "dependency_cascade",
    "horizonsDays": [
      7,
      30,
      90
    ],
    "maxIterations": 100,
    "tolerance": 1e-9,
    "transmission": 0.82
  },
  "scenarioId": "ukraine-commodity-compound-restress",
  "schemaVersion": "0.1.0",
  "shocks": [
    {
      "endsAt": "2026-09-30T00:00:00Z",
      "id": "shock:ukraine-commodity-compound-restress:primary",
      "label": "Compound commodity supply restriction",
      "magnitude": 0.6,
      "operation": "reduce_supply",
      "rationale": "Forward-dated stress inspired by the context reference; timing and magnitude are explicit scenario parameters.",
      "sourceIds": [
        "source:ukraine-commodity-compound-restress:context"
      ],
      "startsAt": "2026-09-01T00:00:00Z",
      "target": {
        "ids": [
          "node:ukraine-commodity-compound-restress:commodity-supply"
        ]
      },
      "unit": "share"
    },
    {
      "endsAt": "2026-09-30T00:00:00Z",
      "id": "shock:ukraine-commodity-compound-restress:secondary",
      "label": "Concurrent policy restriction",
      "magnitude": 0.35,
      "operation": "policy_restrict",
      "rationale": "Explicit compound-stress assumption; not a statement about a current policy.",
      "sourceIds": [
        "source:ukraine-commodity-compound-restress:context"
      ],
      "startsAt": "2026-09-01T00:00:00Z",
      "target": {
        "ids": [
          "node:ukraine-commodity-compound-restress:food-output"
        ]
      },
      "unit": "share"
    }
  ],
  "summary": "A compound forward stress joining assumed food, fertilizer, energy, logistics, and affordability dependencies.",
  "title": "Food, fertilizer, and energy compound re-stress"
}
